{
  "slug": "starter",
  "name": "Starter",
  "headline": "Starter subscription for first production websites",
  "priceAnchor": "$9.99",
  "stripeMode": "subscription",
  "idealFor": "Solo founders and first-time launches",
  "description": "Starter provides baseline monthly access for voice-to-website generation and preview workflows.",
  "category": "platform",
  "deliveryType": "subscription",
  "deliveryCopy": "Monthly subscription access."
}
